{
  "manifest_version": "DAE-CORPUS-SEGMENTATION-1.0",
  "engine_version": "0.10.0-alpha.1",
  "generated_at": "2026-08-11T19:20:29Z",
  "source": {
    "source_id": "LOCAL-SHA256-21BD1B676D9990854F929A3FFB9858DEF1395A3E5808C8D2CC0889D50356B04A",
    "artifact_sha256": "6fd45bb04e5f136a07a6631cf9dcefc605fa0abeab1bb3bb722bb849b40bbe70",
    "artifact_byte_length": 39280,
    "access_class": "DERIVATIVE_ONLY",
    "raw_text_included": false,
    "expressive_context_included": false
  },
  "layer_ontology": [
    "SOURCE",
    "RECONSTRUCTION",
    "PROJECT_CLAIM",
    "RIVAL_OBJECTION",
    "PROTOCOL_TOOL_LOG",
    "UNRESOLVED"
  ],
  "methods": {
    "ooxml_native": "WORDPROCESSINGML_PARAGRAPH_ORDER_PLUS_STYLE_HEADING_PATH_AND_HASH_SELECTORS_1.0",
    "renderer_native": "TRANSIENT_FRESH_PAGE_RUN; DAE-PAGED-LEXICAL-CANDIDATE-0.4; RENDERER_DERIVED",
    "argument_native": "CONTIGUOUS_SAME_HEADING_AND_ROUTED_LAYER_WINDOWS_CAPPED_AT_6_PARAGRAPHS_OR_2000_CHARACTERS_1.0",
    "layer_routing": "WEIGHTED_EXPLICIT_SIGNALS_WITH_MARGIN_AND_UNRESOLVED_FALLBACK_1.0",
    "duplicate_detection": "EXACT_NORMALIZED_SHA256_PLUS_8_VALUE_MINHASH_3_TOKEN_SHINGLES_JACCARD_GE_0.72_1.0"
  },
  "counts": {
    "ooxml_total": 13,
    "ooxml_nonempty": 13,
    "headings": 0,
    "renderer_units": 39,
    "argument_units": 11,
    "layer_routes": {
      "PROJECT_CLAIM": 2,
      "RECONSTRUCTION": 2,
      "UNRESOLVED": 9
    },
    "routing_statuses": {
      "AMBIGUOUS": 9,
      "ROUTED": 2,
      "TENTATIVE": 2
    }
  },
  "ooxml_segments": [
    {
      "segment_id": "OX-P000001-F51BA45F8F",
      "ordinal": 1,
      "selector": {
        "type": "OoxmlParagraphSelector",
        "part": "word/document.xml",
        "paragraph_ordinal": 1,
        "normalized_sha256": "f51ba45f8f123932711eb2570c3319879cde1cd69ca38f727d3066c0a00a68cc"
      },
      "normalized_sha256": "f51ba45f8f123932711eb2570c3319879cde1cd69ca38f727d3066c0a00a68cc",
      "char_length": 379,
      "token_count": 60,
      "style": null,
      "zone": "BODY",
      "language_profile": {
        "dominant": "EN",
        "cyrillic_letters": 0,
        "latin_letters": 309,
        "de_markers": 0,
        "ru_markers": 0,
        "en_markers": 20
      },
      "discourse_features": [
        "CONCLUSION",
        "CONTRAST"
      ],
      "relation_candidates": [
        {
          "rt_id": "RT01",
          "signal_class": "STRONG_LEXICAL"
        },
        {
          "rt_id": "RT18",
          "signal_class": "STRONG_LEXICAL"
        }
      ],
      "layer_routing": {
        "label": "UNRESOLVED",
        "status": "AMBIGUOUS",
        "routing_confidence": 0.25,
        "score_margin": 0,
        "scores": {
          "SOURCE": 0,
          "RECONSTRUCTION": 0,
          "PROJECT_CLAIM": 1,
          "RIVAL_OBJECTION": 1,
          "PROTOCOL_TOOL_LOG": 0
        },
        "signals": [
          "CONTRAST_FORM",
          "STRONG_CONCLUSION"
        ],
        "review_required": true
      },
      "heading_path": [],
      "formula_ids": [],
      "duplicate_cluster_id": null,
      "near_duplicate_cluster_id": null,
      "archive_state": "ACTIVE"
    },
    {
      "segment_id": "OX-P000002-B5BA4EC765",
      "ordinal": 2,
      "selector": {
        "type": "OoxmlParagraphSelector",
        "part": "word/document.xml",
        "paragraph_ordinal": 2,
        "normalized_sha256": "b5ba4ec765159e68af39b4c2a2933da4fe2d3e4fd1aa675c4eef8d060f360dfb"
      },
      "normalized_sha256": "b5ba4ec765159e68af39b4c2a2933da4fe2d3e4fd1aa675c4eef8d060f360dfb",
      "char_length": 1314,
      "token_count": 225,
      "style": null,
      "zone": "BODY",
      "language_profile": {
        "dominant": "EN",
        "cyrillic_letters": 0,
        "latin_letters": 1050,
        "de_markers": 0,
        "ru_markers": 0,
        "en_markers": 72
      },
      "discourse_features": [
        "CONCLUSION",
        "LIMIT"
      ],
      "relation_candidates": [
        {
          "rt_id": "RT23",
          "signal_class": "STRONG_LEXICAL"
        },
        {
          "rt_id": "RT01",
          "signal_class": "STRONG_LEXICAL"
        }
      ],
      "layer_routing": {
        "label": "PROJECT_CLAIM",
        "status": "TENTATIVE",
        "routing_confidence": 0.555556,
        "score_margin": 2.5,
        "scores": {
          "SOURCE": 0,
          "RECONSTRUCTION": 0,
          "PROJECT_CLAIM": 2.5,
          "RIVAL_OBJECTION": 0,
          "PROTOCOL_TOOL_LOG": 0
        },
        "signals": [
          "FIRST_PERSON_PLURAL",
          "STRONG_CONCLUSION"
        ],
        "review_required": true
      },
      "heading_path": [],
      "formula_ids": [],
      "duplicate_cluster_id": null,
      "near_duplicate_cluster_id": null,
      "archive_state": "ACTIVE"
    },
    {
      "segment_id": "OX-P000003-6A7AAEE863",
      "ordinal": 3,
      "selector": {
        "type": "OoxmlParagraphSelector",
        "part": "word/document.xml",
        "paragraph_ordinal": 3,
        "normalized_sha256": "6a7aaee8635b9062f4c878d323a934023b3427d375350bd04270680ccc3263ad"
      },
      "normalized_sha256": "6a7aaee8635b9062f4c878d323a934023b3427d375350bd04270680ccc3263ad",
      "char_length": 546,
      "token_count": 90,
      "style": null,
      "zone": "BODY",
      "language_profile": {
        "dominant": "EN",
        "cyrillic_letters": 0,
        "latin_letters": 441,
        "de_markers": 0,
        "ru_markers": 0,
        "en_markers": 30
      },
      "discourse_features": [
        "CONCLUSION",
        "CONTRAST",
        "LIMIT"
      ],
      "relation_candidates": [
        {
          "rt_id": "RT01",
          "signal_class": "STRONG_LEXICAL"
        }
      ],
      "layer_routing": {
        "label": "UNRESOLVED",
        "status": "AMBIGUOUS",
        "routing_confidence": 0.25,
        "score_margin": 0,
        "scores": {
          "SOURCE": 0,
          "RECONSTRUCTION": 0,
          "PROJECT_CLAIM": 1,
          "RIVAL_OBJECTION": 1,
          "PROTOCOL_TOOL_LOG": 0
        },
        "signals": [
          "CONTRAST_FORM",
          "STRONG_CONCLUSION"
        ],
        "review_required": true
      },
      "heading_path": [],
      "formula_ids": [],
      "duplicate_cluster_id": null,
      "near_duplicate_cluster_id": null,
      "archive_state": "ACTIVE"
    },
    {
      "segment_id": "OX-P000004-1AD3778DEA",
      "ordinal": 4,
      "selector": {
        "type": "OoxmlParagraphSelector",
        "part": "word/document.xml",
        "paragraph_ordinal": 4,
        "normalized_sha256": "1ad3778dea5091f75c1273c4630ebd6cfd795880d95647c0968d1d3b156cf805"
      },
      "normalized_sha256": "1ad3778dea5091f75c1273c4630ebd6cfd795880d95647c0968d1d3b156cf805",
      "char_length": 234,
      "token_count": 43,
      "style": null,
      "zone": "BODY",
      "language_profile": {
        "dominant": "EN",
        "cyrillic_letters": 0,
        "latin_letters": 185,
        "de_markers": 0,
        "ru_markers": 0,
        "en_markers": 16
      },
      "discourse_features": [
        "CONCLUSION"
      ],
      "relation_candidates": [
        {
          "rt_id": "RT06",
          "signal_class": "STRONG_LEXICAL"
        },
        {
          "rt_id": "RT01",
          "signal_class": "STRONG_LEXICAL"
        }
      ],
      "layer_routing": {
        "label": "UNRESOLVED",
        "status": "AMBIGUOUS",
        "routing_confidence": 0.333333,
        "score_margin": 1,
        "scores": {
          "SOURCE": 0,
          "RECONSTRUCTION": 0,
          "PROJECT_CLAIM": 1,
          "RIVAL_OBJECTION": 0,
          "PROTOCOL_TOOL_LOG": 0
        },
        "signals": [
          "STRONG_CONCLUSION"
        ],
        "review_required": true
      },
      "heading_path": [],
      "formula_ids": [],
      "duplicate_cluster_id": null,
      "near_duplicate_cluster_id": null,
      "archive_state": "ACTIVE"
    },
    {
      "segment_id": "OX-P000005-22D36C5702",
      "ordinal": 5,
      "selector": {
        "type": "OoxmlParagraphSelector",
        "part": "word/document.xml",
        "paragraph_ordinal": 5,
        "normalized_sha256": "22d36c5702b58e1bf4e84d9d2fa02234bcc72eb8e1582977c90f4fb90a7be6f9"
      },
      "normalized_sha256": "22d36c5702b58e1bf4e84d9d2fa02234bcc72eb8e1582977c90f4fb90a7be6f9",
      "char_length": 240,
      "token_count": 39,
      "style": null,
      "zone": "BODY",
      "language_profile": {
        "dominant": "EN",
        "cyrillic_letters": 0,
        "latin_letters": 196,
        "de_markers": 0,
        "ru_markers": 0,
        "en_markers": 19
      },
      "discourse_features": [
        "ATTRIBUTION"
      ],
      "relation_candidates": [],
      "layer_routing": {
        "label": "RECONSTRUCTION",
        "status": "ROUTED",
        "routing_confidence": 0.6,
        "score_margin": 3,
        "scores": {
          "SOURCE": 0,
          "RECONSTRUCTION": 3,
          "PROJECT_CLAIM": 0,
          "RIVAL_OBJECTION": 0,
          "PROTOCOL_TOOL_LOG": 0
        },
        "signals": [
          "ATTRIBUTION_FORM"
        ],
        "review_required": true
      },
      "heading_path": [],
      "formula_ids": [],
      "duplicate_cluster_id": null,
      "near_duplicate_cluster_id": null,
      "archive_state": "ACTIVE"
    },
    {
      "segment_id": "OX-P000006-D9C51E7682",
      "ordinal": 6,
      "selector": {
        "type": "OoxmlParagraphSelector",
        "part": "word/document.xml",
        "paragraph_ordinal": 6,
        "normalized_sha256": "d9c51e76822db5d946fe08c95aa4b44e684cd3e591c615ae336ddd005d6167c9"
      },
      "normalized_sha256": "d9c51e76822db5d946fe08c95aa4b44e684cd3e591c615ae336ddd005d6167c9",
      "char_length": 323,
      "token_count": 54,
      "style": null,
      "zone": "BODY",
      "language_profile": {
        "dominant": "EN",
        "cyrillic_letters": 0,
        "latin_letters": 263,
        "de_markers": 0,
        "ru_markers": 0,